{
 "schemaVersion": 1,
 "kind": "skill-family.documentation-capability-catalog",
 "bundle": "core",
 "generatedFrom": [
  "package.json",
  "packages/skill-family-contracts/package.json",
  "packages/skill-family-harness-node/package.json",
  "packages/skill-family-engineering-kit/package.json",
  "packages/skill-family-contracts/src/index.mjs",
  "packages/skill-family-contracts/src/stability.mjs",
  "packages/skill-family-harness-node/src/index.mjs",
  "packages/skill-family-engineering-kit/src/index.mjs",
  "packages/skill-family-engineering-kit/src/cli.mjs",
  "packages/skill-family-contracts/src/registry.json",
  "profiles/README.md",
  "docs/architecture.md",
  "docs/status/current.md"
 ],
 "capabilities": [
  {
   "id": "foundation.contracts.object-validation",
   "package": "skill-family-contracts",
   "layer": "contracts",
   "since": "0.2.0",
   "stability": "stable",
   "adoptionScopes": ["contracts"],
      "entrypoints": [
        "validateDocument (packages/skill-family-contracts/src/validator.mjs)",
        "compileSchema (packages/skill-family-contracts/src/validator.mjs)",
        "detectDialect (packages/skill-family-contracts/src/validator.mjs)",
        "professional-conclusion Schema (packages/skill-family-contracts/src/schemas/professional-conclusion.schema.json)"
      ],
      "sourceRefs": [
        "packages/skill-family-contracts/src/validator.mjs",
        "packages/skill-family-contracts/src/schemas/professional-conclusion.schema.json",
        "packages/skill-family-contracts/src/schemas/project-manifest.schema.json"
   ],
   "positiveTestRefs": [
    "packages/skill-family-contracts/test/validator.test.mjs",
    "packages/skill-family-contracts/test/schemas.test.mjs",
    "packages/skill-family-contracts/test/host-contracts.test.mjs",
    "packages/skill-family-contracts/test/report-contracts.test.mjs"
   ],
   "negativeTestRefs": [
    "packages/skill-family-contracts/test/validator.test.mjs",
    "packages/skill-family-contracts/test/host-contracts.test.mjs",
    "packages/skill-family-contracts/test/report-contracts.test.mjs"
   ],
   "consumerTesting": {
    "strategy": "real-pure",
    "vectorSetId": "foundation.contracts.object-validation.consumer-v1",
    "vectorEntrypoint": "skill-family-contracts: listConsumerContractVectors, verifyConsumerContractVector",
    "runtimeEntrypoint": "skill-family-contracts: validateDocument"
   }
  },
  {
   "id": "foundation.contracts.registry-protocol",
   "package": "skill-family-contracts",
   "layer": "contracts",
   "since": "0.2.0",
   "stability": "stable",
   "adoptionScopes": ["contracts"],
   "entrypoints": [
    "loadRegistry (packages/skill-family-contracts/src/registry.mjs)",
    "findSchemaByObject (packages/skill-family-contracts/src/registry.mjs)",
    "findProtocol (packages/skill-family-contracts/src/registry.mjs)",
    "registerSchema (packages/skill-family-contracts/src/registry.mjs)",
    "registerProtocol (packages/skill-family-contracts/src/registry.mjs)"
   ],
   "sourceRefs": [
    "packages/skill-family-contracts/src/registry.mjs",
    "packages/skill-family-contracts/src/registry.json"
   ],
   "positiveTestRefs": [
    "packages/skill-family-contracts/test/registry.test.mjs"
   ],
   "negativeTestRefs": [
    "packages/skill-family-contracts/test/registry.test.mjs"
   ]
  },
  {
   "id": "foundation.contracts.kernel-protocol",
   "package": "skill-family-contracts",
   "layer": "contracts",
   "since": "0.2.0",
   "stability": "stable",
   "adoptionScopes": ["contracts"],
   "entrypoints": [
    "loadKernelProtocol (packages/skill-family-contracts/src/kernel.mjs)",
    "findOperation (packages/skill-family-contracts/src/kernel.mjs)",
    "checkOperation (packages/skill-family-contracts/src/kernel.mjs)"
   ],
   "sourceRefs": [
    "packages/skill-family-contracts/src/kernel.mjs",
    "packages/skill-family-contracts/src/kernel-protocol.json"
   ],
   "positiveTestRefs": [
    "packages/skill-family-contracts/test/kernel.test.mjs"
   ],
   "negativeTestRefs": [
    "packages/skill-family-contracts/test/kernel.test.mjs"
   ]
  },
  {
   "id": "foundation.contracts.mandatory-checks",
   "package": "skill-family-contracts",
   "layer": "contracts",
   "since": "0.2.0",
   "stability": "stable",
   "adoptionScopes": ["contracts"],
   "entrypoints": [
    "runChecks (packages/skill-family-contracts/src/checker.mjs)",
    "collectUnresolvedRefs (packages/skill-family-contracts/src/checker.mjs)"
   ],
   "sourceRefs": [
    "packages/skill-family-contracts/src/checker.mjs",
    "packages/skill-family-contracts/src/rules.json"
   ],
   "positiveTestRefs": [
    "packages/skill-family-contracts/test/checker.test.mjs"
   ],
   "negativeTestRefs": [
    "packages/skill-family-contracts/test/checker.test.mjs"
   ]
  },
  {
   "id": "foundation.contracts.fixture-verification",
   "package": "skill-family-contracts",
   "layer": "contracts",
   "since": "0.2.0",
   "stability": "stable",
   "adoptionScopes": ["contracts"],
   "entrypoints": [
    "verifyFixture (packages/skill-family-contracts/src/fixtures.mjs)",
    "verifyAllFixtures (packages/skill-family-contracts/src/fixtures.mjs)",
    "listFixtures (packages/skill-family-contracts/src/fixtures.mjs)",
    "fixtureClasses (packages/skill-family-contracts/src/fixtures.mjs)"
   ],
   "sourceRefs": [
    "packages/skill-family-contracts/src/fixtures.mjs"
   ],
   "positiveTestRefs": [
    "packages/skill-family-contracts/test/fixtures.test.mjs"
   ],
   "negativeTestRefs": [
    "packages/skill-family-contracts/test/fixtures.test.mjs"
   ]
  },
  {
   "id": "foundation.contracts.error-codes",
   "package": "skill-family-contracts",
   "layer": "contracts",
   "since": "0.2.0",
   "stability": "stable",
   "adoptionScopes": ["contracts"],
   "entrypoints": [
    "ContractsError (packages/skill-family-contracts/src/errors.mjs)",
    "ERROR_CODES (packages/skill-family-contracts/src/errors.mjs)",
    "isRegisteredErrorCode (packages/skill-family-contracts/src/errors.mjs)",
    "assertRegisteredErrorCode (packages/skill-family-contracts/src/errors.mjs)",
    "stableError (packages/skill-family-contracts/src/errors.mjs)"
   ],
   "sourceRefs": [
    "packages/skill-family-contracts/src/errors.mjs",
    "packages/skill-family-contracts/src/error-codes.json"
   ],
   "positiveTestRefs": [
    "packages/skill-family-contracts/test/boundary.test.mjs",
    "packages/skill-family-contracts/test/immutability.test.mjs"
   ],
   "negativeTestRefs": [
    "packages/skill-family-contracts/test/immutability.test.mjs",
    "packages/skill-family-contracts/test/audit-surface.test.mjs"
   ]
  },
  {
   "id": "foundation.contracts.audit-surface",
   "package": "skill-family-contracts",
   "layer": "contracts",
   "since": "0.2.0",
   "stability": "stable",
   "adoptionScopes": ["contracts"],
   "entrypoints": [
    "describeAuditSurface (packages/skill-family-contracts/src/audit-surface.mjs)",
    "digestAuditSurface (packages/skill-family-contracts/src/audit-surface.mjs)",
    "canonicalJson (packages/skill-family-contracts/src/audit-surface.mjs)",
    "digestDocument (packages/skill-family-contracts/src/audit-surface.mjs)"
   ],
   "sourceRefs": [
    "packages/skill-family-contracts/src/audit-surface.mjs"
   ],
   "positiveTestRefs": [
    "packages/skill-family-contracts/test/audit-surface.test.mjs"
   ],
   "negativeTestRefs": [
    "packages/skill-family-contracts/test/audit-surface.test.mjs"
   ]
  },
  {
   "id": "foundation.contracts.token-estimate-consumption",
   "package": "skill-family-contracts",
   "layer": "contracts",
   "since": "0.6.0",
   "stability": "stable",
   "adoptionScopes": ["contracts"],
   "entrypoints": [
    "TOKEN_ESTIMATE_CONSUMPTION (packages/skill-family-contracts/src/token-estimate-consumption.mjs)",
    "TOKEN_ESTIMATE_CONSUMPTION_REASONS (packages/skill-family-contracts/src/token-estimate-consumption.mjs)",
    "TOKEN_ESTIMATE_CONSUMPTION_ERROR_KIND (packages/skill-family-contracts/src/token-estimate-consumption.mjs)",
    "consumeTokenEstimate (packages/skill-family-contracts/src/token-estimate-consumption.mjs)",
    "consumeTokenEstimateStrict (packages/skill-family-contracts/src/token-estimate-consumption.mjs)"
   ],
   "sourceRefs": [
    "packages/skill-family-contracts/src/token-estimate-consumption.mjs",
    "packages/skill-family-contracts/src/schemas/token-estimate-record.schema.json"
   ],
   "positiveTestRefs": [
    "packages/skill-family-contracts/test/token-estimate-consumption.test.mjs"
   ],
   "negativeTestRefs": [
    "packages/skill-family-contracts/test/token-estimate-consumption.test.mjs"
   ]
  },
  {
   "id": "foundation.harness.contract-validation",
   "package": "skill-family-harness-node",
   "layer": "harness",
   "since": "0.2.0",
   "stability": "stable",
   "adoptionScopes": ["harness"],
   "entrypoints": [
    "validateContractDocument (packages/skill-family-harness-node/src/validation.mjs)",
    "getValidator (packages/skill-family-harness-node/src/validation.mjs)",
    "resolveSchemaContext (packages/skill-family-harness-node/src/validation.mjs)",
    "validatorCacheSize (packages/skill-family-harness-node/src/validation.mjs)"
   ],
   "sourceRefs": [
    "packages/skill-family-harness-node/src/validation.mjs"
   ],
   "positiveTestRefs": [
    "packages/skill-family-harness-node/test/validation.test.mjs"
   ],
   "negativeTestRefs": [
    "packages/skill-family-harness-node/test/validation.test.mjs"
   ]
  },
  {
   "id": "foundation.harness.path-containment",
   "package": "skill-family-harness-node",
   "layer": "harness",
   "since": "0.2.0",
   "stability": "stable",
   "adoptionScopes": ["harness"],
   "entrypoints": [
    "classifyPathInput (packages/skill-family-harness-node/src/paths.mjs)",
    "resolveContained (packages/skill-family-harness-node/src/paths.mjs)",
    "readFileContained (packages/skill-family-harness-node/src/paths.mjs)"
   ],
   "sourceRefs": [